<?xml version="1.0" encoding="UTF-8"?>
<HolesList xmlns:od="urn:schemas-microsoft-com:officedata" xmlns:xsi="http://www.w3.org/2001/XMLSchema-instance"  xsi:noNamespaceSchemaLocation="Holes.xsd" generated="2021-06-05T13:50:09">
<Holes>
<CourseId>1</CourseId>
<NineName>Back</NineName>
<HoleNo>10</HoleNo>
<Hdcp>4</Hdcp>
<Par>5</Par>
</Holes>
<Holes>
<CourseId>1</CourseId>
<NineName>Back</NineName>
<HoleNo>11</HoleNo>
<Hdcp>10</Hdcp>
<Par>3</Par>
</Holes>
<Holes>
<CourseId>1</CourseId>
<NineName>Back</NineName>
<HoleNo>12</HoleNo>
<Hdcp>12</Hdcp>
<Par>4</Par>
</Holes>
<Holes>
<CourseId>1</CourseId>
<NineName>Back</NineName>
<HoleNo>13</HoleNo>
<Hdcp>16</Hdcp>
<Par>4</Par>
</Holes>
<Holes>
<CourseId>1</CourseId>
<NineName>Back</NineName>
<HoleNo>14</HoleNo>
<Hdcp>8</Hdcp>
<Par>4</Par>
</Holes>
<Holes>
<CourseId>1</CourseId>
<NineName>Back</NineName>
<HoleNo>15</HoleNo>
<Hdcp>18</Hdcp>
<Par>4</Par>
</Holes>
<Holes>
<CourseId>1</CourseId>
<NineName>Back</NineName>
<HoleNo>16</HoleNo>
<Hdcp>6</Hdcp>
<Par>4</Par>
</Holes>
<Holes>
<CourseId>1</CourseId>
<NineName>Back</NineName>
<HoleNo>17</HoleNo>
<Hdcp>14</Hdcp>
<Par>3</Par>
</Holes>
<Holes>
<CourseId>1</CourseId>
<NineName>Back</NineName>
<HoleNo>18</HoleNo>
<Hdcp>2</Hdcp>
<Par>5</Par>
</Holes>
<Holes>
<CourseId>1</CourseId>
<NineName>Front</NineName>
<HoleNo>1</HoleNo>
<Hdcp>7</Hdcp>
<Par>4</Par>
</Holes>
<Holes>
<CourseId>1</CourseId>
<NineName>Front</NineName>
<HoleNo>2</HoleNo>
<Hdcp>1</Hdcp>
<Par>5</Par>
</Holes>
<Holes>
<CourseId>1</CourseId>
<NineName>Front</NineName>
<HoleNo>3</HoleNo>
<Hdcp>13</Hdcp>
<Par>4</Par>
</Holes>
<Holes>
<CourseId>1</CourseId>
<NineName>Front</NineName>
<HoleNo>4</HoleNo>
<Hdcp>15</Hdcp>
<Par>4</Par>
</Holes>
<Holes>
<CourseId>1</CourseId>
<NineName>Front</NineName>
<HoleNo>5</HoleNo>
<Hdcp>17</Hdcp>
<Par>4</Par>
</Holes>
<Holes>
<CourseId>1</CourseId>
<NineName>Front</NineName>
<HoleNo>6</HoleNo>
<Hdcp>11</Hdcp>
<Par>3</Par>
</Holes>
<Holes>
<CourseId>1</CourseId>
<NineName>Front</NineName>
<HoleNo>7</HoleNo>
<Hdcp>5</Hdcp>
<Par>4</Par>
</Holes>
<Holes>
<CourseId>1</CourseId>
<NineName>Front</NineName>
<HoleNo>8</HoleNo>
<Hdcp>3</Hdcp>
<Par>3</Par>
</Holes>
<Holes>
<CourseId>1</CourseId>
<NineName>Front</NineName>
<HoleNo>9</HoleNo>
<Hdcp>9</Hdcp>
<Par>5</Par>
</Holes>
<Holes>
<CourseId>2</CourseId>
<NineName>Back</NineName>
<HoleNo>10</HoleNo>
<Hdcp>6</Hdcp>
<Par>5</Par>
</Holes>
<Holes>
<CourseId>2</CourseId>
<NineName>Back</NineName>
<HoleNo>11</HoleNo>
<Hdcp>10</Hdcp>
<Par>3</Par>
</Holes>
<Holes>
<CourseId>2</CourseId>
<NineName>Back</NineName>
<HoleNo>12</HoleNo>
<Hdcp>12</Hdcp>
<Par>4</Par>
</Holes>
<Holes>
<CourseId>2</CourseId>
<NineName>Back</NineName>
<HoleNo>13</HoleNo>
<Hdcp>18</Hdcp>
<Par>4</Par>
</Holes>
<Holes>
<CourseId>2</CourseId>
<NineName>Back</NineName>
<HoleNo>14</HoleNo>
<Hdcp>4</Hdcp>
<Par>4</Par>
</Holes>
<Holes>
<CourseId>2</CourseId>
<NineName>Back</NineName>
<HoleNo>15</HoleNo>
<Hdcp>16</Hdcp>
<Par>4</Par>
</Holes>
<Holes>
<CourseId>2</CourseId>
<NineName>Back</NineName>
<HoleNo>16</HoleNo>
<Hdcp>8</Hdcp>
<Par>4</Par>
</Holes>
<Holes>
<CourseId>2</CourseId>
<NineName>Back</NineName>
<HoleNo>17</HoleNo>
<Hdcp>14</Hdcp>
<Par>3</Par>
</Holes>
<Holes>
<CourseId>2</CourseId>
<NineName>Back</NineName>
<HoleNo>18</HoleNo>
<Hdcp>2</Hdcp>
<Par>5</Par>
</Holes>
<Holes>
<CourseId>2</CourseId>
<NineName>Front</NineName>
<HoleNo>1</HoleNo>
<Hdcp>11</Hdcp>
<Par>4</Par>
</Holes>
<Holes>
<CourseId>2</CourseId>
<NineName>Front</NineName>
<HoleNo>2</HoleNo>
<Hdcp>7</Hdcp>
<Par>5</Par>
</Holes>
<Holes>
<CourseId>2</CourseId>
<NineName>Front</NineName>
<HoleNo>3</HoleNo>
<Hdcp>5</Hdcp>
<Par>4</Par>
</Holes>
<Holes>
<CourseId>2</CourseId>
<NineName>Front</NineName>
<HoleNo>4</HoleNo>
<Hdcp>17</Hdcp>
<Par>4</Par>
</Holes>
<Holes>
<CourseId>2</CourseId>
<NineName>Front</NineName>
<HoleNo>5</HoleNo>
<Hdcp>15</Hdcp>
<Par>4</Par>
</Holes>
<Holes>
<CourseId>2</CourseId>
<NineName>Front</NineName>
<HoleNo>6</HoleNo>
<Hdcp>13</Hdcp>
<Par>3</Par>
</Holes>
<Holes>
<CourseId>2</CourseId>
<NineName>Front</NineName>
<HoleNo>7</HoleNo>
<Hdcp>1</Hdcp>
<Par>4</Par>
</Holes>
<Holes>
<CourseId>2</CourseId>
<NineName>Front</NineName>
<HoleNo>8</HoleNo>
<Hdcp>3</Hdcp>
<Par>3</Par>
</Holes>
<Holes>
<CourseId>2</CourseId>
<NineName>Front</NineName>
<HoleNo>9</HoleNo>
<Hdcp>9</Hdcp>
<Par>5</Par>
</Holes>
</HolesList>
